
"Diplomats discuss Chinese-style modernization, China ...",https://kpl.gov.la/en/detail.aspx?id=72434
Chinese path to modernization: Does the West understand?,http://www.china-ceec.org/eng/sjzs/202211/t20221122_10979060.htm
Getting Chinese modernization right,https://www.bjreview.com/Opinion/Voice/202301/t20230113_800318493.html
Xi Jinping Touts China's Modernization Path at Political ...,https://www.bloomberg.com/news/articles/2023-03-15/xi-touts-china-s-modernization-path-at-political-parties-summit
Hong Kong court puts off Chinese developer Evergrande's ...,https://wtop.com/real-estate/2023/12/chinese-developer-evergrande-risking-liquidation-if-creditors-veto-its-plan-for-handling-huge-debts/
What are the distinctive characteristics of the Chinese path ...,https://www.quora.com/What-are-the-distinctive-characteristics-of-the-Chinese-path-to-modernization
History of Japan,https://en.wikipedia.org/wiki/History_of_Japan
Samurai,https://en.wikipedia.org/wiki/Samurai
The global significance of Chinese Modernization,http://be.china-embassy.gov.cn/eng/rv/202305/t20230511_11075213.htm
Chinese Modernization Is Socialist Modernization Led by ...,http://en.qstheory.cn/2023-09/13/c_918746.htm
Triple Logic of Promoting Common Prosperity in the Process ...,https://drpress.org/ojs/index.php/ajmss/article/view/8763/8537
Glimpses into the Chinese path to modernization,https://www.chinadaily.com.cn/a/202302/02/WS63dafc22a31057c47ebac697.html
"Encouraged by Xi's words, Northeast China explores ...",https://www.globaltimes.cn/page/202303/1286479.shtml
Second Sino-Japanese War,https://en.wikipedia.org/wiki/Second_Sino-Japanese_War
Xi: Forge new drivers for modernization,https://www.chinadaily.com.cn/a/202302/08/WS63e2765da31057c47ebad75c.html
The Creative Path to Chinese-style Modernization,https://news.cgtn.com/news/2023-03-25/The-Creative-Path-to-Chinese-style-Modernization-1irybZ9GzkY/index.html
Xi's Chinese-style modernization: tactical flexibility and ...,https://merics.org/en/comment/xis-chinese-style-modernization-tactical-flexibility-and-ideological-steadfastness
Xi stresses promoting common prosperity amid high-quality ...,http://www.xinhuanet.com/english/2021-08/18/c_1310133051.htm
Chinese modernization a highlight of 20th CPC National ...,http://www.focac.org/eng/zfzs_1/202211/t20221108_10801797.htm
What kind of modernization is China seeking? - Xinhua,http://www.xinhuanet.com/english/2021-03/10/c_139800416.htm
History of East Asia,https://en.wikipedia.org/wiki/History_of_East_Asia
China's 'Common Prosperity' Pathway to Socialist ...,https://chinaus-icas.org/research/chinas-common-prosperity-pathway-to-socialist-modernization/
"US Navy, UK, Australia will test AI system to help crews ...",https://www.businesstimes.com.sg/international/us-navy-uk-australia-will-test-ai-system-help-crews-track-chinese-submarines-pacific
"Unveiling the Laws of the Rise and Fall of Civilizations, and ...",https://interpret.csis.org/translations/unveiling-the-laws-of-the-rise-and-fall-of-civilizations-and-mapping-the-path-of-civilizational-development-the-theoretical-implications-and-practical-value-of-the-global-civilization-initiat/
Chinese modernization is not pursued through war ...,https://www.facebook.com/chinadaily/videos/chinese-modernization-is-not-pursued-through-war-colonization-or-plundering/1410596953032768/
What message does Xi Jinping's Shanghai visit send?,https://www.gingerriver.com/p/what-message-does-xi-jinpings-shanghai
Prospects for Democracy and Democratization in Chinese ...,https://diamond-democracy.stanford.edu/speaking/speeches/prospects-democracy-and-democratization-chinese-societies
Explained: Chinese versus Western modernization,http://www.bjreview.com/China/202210/t20221021_800311183.html
50 foreigners honored for contributions to Shanghai,http://english.anhuinews.com/newscenter/headline/202312/t20231205_7255544.html
Chinese Modernization: Themes and Strategic Fulcrum,https://search.proquest.com/openview/9d48a823c882f2db43dc42483d365e45/1?pq-origsite=gscholar&cbl=1806366
Yellen Calls for 'Constructive' China Relationship,https://www.nytimes.com/2023/04/20/business/economy/yellen-us-china-relationship.html
The Basic Realization of Socialist Modernization by 2035,https://link.springer.com/chapter/10.1007/978-981-99-3397-6_2
"Digital economy, credit expansion, and modernization of ...",https://www.sciencedirect.com/science/article/abs/pii/S1544612323008723
Tibetans in exile accuse China of destroying their identity ...,https://www.winnipegfreepress.com/arts-and-life/life/faith/2023/12/10/tibetans-in-exile-accuse-china-of-destroying-their-identity-in-tibet-under-its-rule
BIS Strengthens Export Controls Targeting China's ...,https://www.jdsupra.com/legalnews/bis-strengthens-export-controls-8780621/
2023 Party Core Reading: Xi on Chinese Modernization,https://gaodawei.wordpress.com/2023/07/05/2023-party-core-reading-xi-on-chinese-modernization/
Chinese modernization is oriented to high-quality growth,https://www.globaltimes.cn/page/202303/1288281.shtml
Realizing moderate prosperity: A new path of 'Chinese- ...,https://www.prnewswire.com/news-releases/realizing-moderate-prosperity-a-new-path-of-chinese-style-modernization-301388672.html
Facilitating Chinese Path to Modernization Through New ...,http://www.jjdl.com.cn/EN/10.15957/j.cnki.jjdl.2023.01.002
New Journey towards Chinese-style Modernization,https://investinchina.chinaservicesinfo.com/investspecials/chinesestylemodernization
Tibetans in exile accuse China of destroying their identity ...,https://news.yahoo.com/tibetans-exile-accuse-china-destroying-072530157.html
China's exports in November edged higher for the first time ...,https://wtop.com/world/2023/12/chinas-exports-in-november-edged-higher-for-the-first-time-in-7-months-while-imports-fell/
Four Modernizations - Wikipedia,https://en.wikipedia.org/wiki/Four_Modernizations
Chinese Modernization and the World: Common Prosperity ...,https://www.khmertimeskh.com/501261930/chinese-modernization-and-the-world-common-prosperity-for-all-people/
Imperial Japanese Navy,https://en.wikipedia.org/wiki/Imperial_Japanese_Navy
Green Development Hailed as Key towards Chinese ...,http://ws.china-embassy.gov.cn/eng/xwdt/202211/t20221121_10978402.htm
China's modernization through the lens of my story,https://jubaecho.com/2022/11/14/chinas-modernization-through-the-lens-of-my-story/
The Positioning of Chinese-style Modernization - 教学与研究,http://jxyyj.ruc.edu.cn/EN/Y2022/V56/I10/15
"A China, EU summit exposes divisions over Ukraine, trade ...",https://wtop.com/europe/2023/12/divides-over-trade-and-ukraine-are-in-focus-as-eu-and-chinas-leaders-meet-in-beijing/
Chinese modernization to create more opportunities for global ...,http://english.www.gov.cn/news/videos/202303/06/content_WS64054c28c6d0a757729e7c78.html
Japan,https://en.wikipedia.org/wiki/Japan
"Business School, Beijing Normal University",https://bs.bnu.edu.cn/englishversion/news/1e4c8631caa545f88916e5a2a60be4b3.html
Chinese modernization is a significant reference for ...,https://www.globaltimes.cn/page/202305/1291700.shtml
Rising aging population does not necessarily slow down ...,https://global.chinadaily.com.cn/a/202304/19/WS643f2623a310b6054face5c9.html
Chinese modernization a highlight of 20th CPC National ...,http://en.people.cn/n3/2022/1107/c90000-10168076.html
Work report is Chinese-style modernization on full display,https://s.chinadailyhk.com/uiuUf2
Science and education: Major elements in modernisation bid,https://www.universityworldnews.com/post.php?story=20221026140308243
Facilitating Chinese Path to Modernization Through New- ...,https://www.jjdl.com.cn/EN/10.15957/j.cnki.jjdl.2023.01.002
High-quality manufacturing supports Chinese-style ...,https://news.cgtn.com/news/2023-07-07/High-quality-manufacturing-supports-Chinese-style-modernization--1lfBRGiCtl6/index.html
China expounds indigenous way to achieve modernization ...,https://www.globaltimes.cn/page/202210/1277278.shtml
"China's path to modernization has, for centuries, gone ...",https://www.technologyreview.com/2021/06/30/1026515/build-strong-china-science-technology/
China's Development Creates More Opportunities for the World,http://lv.china-embassy.gov.cn/eng/xwdt/202211/t20221104_10800517.htm
Chinese modernization carries global significance,https://english.www.gov.cn/news/topnews/202210/21/content_WS635207e1c6d0a757729e17c4.html
'Chinese-style modernization' demonstrates self-confidence,https://www.chinadailyhk.com/article/295573
Chinese path to modernization hailed | Article - China Daily,https://s.chinadailyhk.com/eq2Av2
What Is Meant by Chinese Modernisation? - YouTube,https://www.youtube.com/watch?v=6zr67BEASlM
Xi's footprint in Guangdong offers insights into practical ...,https://www.globaltimes.cn/page/202304/1289354.shtml
Xi's article on Chinese modernization to be published,http://english.scio.gov.cn/topnews/2023-08/15/content_103383008.htm
"Chinese experts, ASEAN diplomats discuss ...",https://www.chinadaily.com.cn/a/202310/28/WS653c8ca8a31090682a5eb3af.html
Watch: Chinese modernization and the world,https://news.cgtn.com/news/2023-03-23/Watch-Chinese-modernization-and-the-world-perspectives-of-economists-1iplGm8Em4M/index.html
How does Chinese modernization differ from Western-style ...,https://english.cctv.com/2023/03/14/VIDEnknuY70BVHNCVHjilrUE230314.shtml
China's Xi calls for patience as Communist Party tries to ...,https://apnews.com/article/china-economy-xi-jinping-31f7da267b90d5b9c0136734bd63c155
How Chinese-style Modernization Promotes the Sharing of ...,https://china-cee.eu/2022/11/30/how-chinese-style-modernization-promotes-the-sharing-of-development-opportunities-in-europe/
Some aspects of China's model modernization,https://www.vietnam.vn/en/vai-net-ve-hien-dai-hoa-mo-hinh-trung-quoc/
China's Unique Path to Modernization,http://www.chinatoday.com.cn/ctenglish/2018/ln/202210/t20221011_800309007.html
"China today has fewer ads, cleaner toilets, economic hurdles",https://asia.nikkei.com/Editor-s-Picks/China-up-close/Analysis-China-today-has-fewer-ads-cleaner-toilets-economic-hurdles
Henry Ho: China takes bold strides on own path of ...,http://octsyouth.hk/henry-ho-modernization/
can it replace the Western model of modernization?,https://scholar.archive.org/work/yygpsnewgfedlloz6rl3vtovoa/access/wayback/http://gpepsm.paginas.ufsc.br/files/2014/11/The-China-Model.pdf
Cambodia's Ream Naval Base: As first Chinese warships ...,https://www.cnn.com/2023/12/07/asia/cambodia-ream-naval-base-chinese-warships-us-analysis/index.html
CHINA'S PATH TO MODERNIZATION,http://www.bjreview.com/2022pdf/NO_43_2022.pdf
National Revolutionary Army,https://en.wikipedia.org/wiki/National_Revolutionary_Army
Chinese modernization unique but beneficial to world,https://www.chinadaily.com.cn/a/202212/29/WS63accc78a31057c47eba6b02.html
Guest Opinion: Chinese modernization and the world,https://english.news.cn/20230518/c9c676ea055c48c1bb9885978b6fa644/c.html
Why Common Prosperity Is Alarming China's Billionaires,https://time.com/6095560/china-common-prosperity/
How China broke the West's monopoly on modernization,https://www.csmonitor.com/Commentary/Global-Viewpoint/2011/0428/How-China-broke-the-West-s-monopoly-on-modernization
Chinese Bulker Hits Moored Fishing Boat off the Philippines,https://maritime-executive.com/article/chinese-bulker-hits-moored-fishing-boat-off-the-philippines
Russian Empire,https://en.wikipedia.org/wiki/Russian_Empire
Chinese modernization 'common prosperity' for all – experts,https://www.pna.gov.ph/articles/1197416
Liu Shouying - What's Chinese-Style Modernization? Key ...,https://www.youtube.com/watch?v=ALTJXC_Aqp4
Xi Jinping Advocates for Chinese-Style Modernization,https://bnn.network/world/china/xi-jinping-advocates-for-chinese-style-modernization-a-path-distinct-from-westernization/
The Chinese Experience of Rapid Modernization,https://www.frontiersin.org/articles/10.3389/fpsyg.2016.00477
Chang'an Avenue and the Modernization of Chinese ...,https://uwapress.uw.edu/book/9780295992136/changan-avenue-and-the-modernization-of-chinese-architecture
Harmony between humanity and nature,http://english.scio.gov.cn/videos/2022-11/08/content_78507540.htm
Democracy activist Agnes Chow says she still feels under ...,https://wtop.com/world/2023/12/democracy-activist-agnes-chow-says-she-still-feels-under-the-hong-kong-polices-watch-in-canada/
Economy of China,https://en.wikipedia.org/wiki/Economy_of_China
Martin Jacques：China's success comes from seeking its ...,https://fddi.fudan.edu.cn/fddien/1b/a2/c19495a465826/page.htm
Chinese-style Modernization,https://chinamediaproject.org/the_ccp_dictionary/chinese-style-modernization/
Xi stresses high-quality development in China's ...,http://english.scio.gov.cn/m/topnews/2023-03/06/content_85146706.htm
The Modernization of 1.4 Billion,https://news.cgtn.com/news/2023-10-04/The-Modernization-of-1-4-Billion-1nDiWyMc7Ju/index.html
Ding Xuexiang Visits Turkmenistan - Xi's Shanghai Inspection,https://trackingpeoplesdaily.substack.com/p/ding-xuexiang-visits-turkmenistan
Modernization,https://chinamediaproject.org/the_ccp_dictionary/modernization/
Unpacking the Idea of Modernization of Chinese- Style ...,https://brill.com/downloadpdf/journals/bire/5/1-2/article-p169_012.pdf
'Dare to fight': Xi Jinping unveils China's new world order,https://www.ft.com/content/0f0b558b-3ca8-4156-82c8-e1825539ee20
The Path to the Socialist Modernization with Chinese ...,https://link.springer.com/chapter/10.1007/978-981-99-3397-6_1
TALK AFRICA: China bridging the divide - YouTube,https://www.youtube.com/watch?v=MKlJV890Y5w
Belt and Road key to fair global modernization,http://epaper.chinadaily.com.cn/a/202310/31/WS65404728a310d4219e3a9a7d.html
What are the benefits of wearing traditional clothes over ...,https://www.quora.com/What-are-the-benefits-of-wearing-traditional-clothes-over-modern-clothes-in-ancient-China-Han-dynasty
China's Xi Jinping set to steer economy down the path of ...,https://www.rfa.org/english/news/china/china-modernization-10262022145013.html
What can the Chinese path to modernization bring ...,https://www.chinadaily.com.cn/a/202306/05/WS647d8e5ea31033ad3f7ba898.html
People's Liberation Army,https://en.wikipedia.org/wiki/People%27s_Liberation_Army
Xi Jinping Stresses Primacy of Communist Party of China ...,https://www.chinabankingnews.com/2023/02/09/xi-jinping-stresses-primacy-of-communist-party-of-china-and-traditional-chinese-culture-in-achieving-unique-form-of-chinese-style-modernization/
Chinese modernization will broaden horizon of civilization,https://www.globaltimes.cn/page/202210/1277276.shtml
Unpacking the Idea of Modernization of Chinese-Style ...,https://brill.com/view/journals/bire/5/1-2/article-p169_012.xml?language=en
China's Communist Party congress expected to reappoint ...,https://www.pbs.org/newshour/world/chinas-communist-party-congress-expected-to-reappoint-xi-jinping-as-leader
Paths to Modernization class 11 Notes History,https://mycbseguide.com/blog/paths-modernization-class-11-notes-history/
The essence of Chinese modernization | Israel Defense,https://www.israeldefense.co.il/en/node/57297
Xi Jinping Launches His “Non-Western” Model of ...,https://bitterwinter.org/xi-jinping-non-western-model-of-modernization/
Modernization Chinese Style,https://www.futuribles.com/en/la-modernisation-a-la-chinoise/
China's path to modernization,https://www.youtube.com/watch?v=h8JwEY7Hwkk
Discussion on the Origin of Chinese Modernization from the ...,https://ojs.bbwpublisher.com/index.php/JCER/article/view/5510
Chinese Modernization and Our Mission,https://www.jjdl.com.cn/EN/abstract/abstract54176.shtml
"Under Xi, China wants absolute security. It's making the ...",https://www.washingtonpost.com/world/2022/10/21/china-xi-jinping-congress-absolute-security/
hong kong in the process of chinese modernization,https://bau.com.hk/article/2023-05/01/content_1102539876727427072.html
New Chinese Naval Base in Cambodia Receives First PLA ...,https://maritime-executive.com/article/new-chinese-naval-base-in-cambodia-receives-first-pla-navy-warships
Forum discusses ways to better convey the concept of ...,http://www.bjreview.com/China/202307/t20230714_800336840.html
The Five Fundamental Characteristics of China's ...,https://www.clausiuspress.com/article/8755.html
China's Unique Path to Modernization,http://www.cnfocus.com/china-s-unique-path-to-modernization/
Chinese-style modernization is transforming Qinghai - YouTube,https://www.youtube.com/watch?v=hPb2ZXbYqX0
"Sustainable growth, legal reforms key to Chinese-style ...",https://www.chinadaily.com.cn/a/202306/19/WS648fa798a31033ad3f7bcf7a.html
What China's increasing use of military over diplomacy ...,https://news.yahoo.com/china-increasing-military-over-diplomacy-101000970.html
China's path to modernization unique - Opinion,https://www.chinadaily.com.cn/a/202209/05/WS63153baba310fd2b29e75d9c.html
Research on the Modernization of Chinese Higher Education,https://jykx.lnnu.edu.cn/EN/abstract/abstract317.shtml
The Chinese Discourse of Power: Diplomacy at its Core,https://isdp.eu/the-chinese-alternative-discourse-of-power-diplomacy-at-its-core/
China's military modernisation,https://www.eastasiaforum.org/2020/12/16/chinas-military-modernisation/
China's image shines brighter as it marches toward ...,https://www.globaltimes.cn/page/202210/1277651.shtml
An Interpretation of the Chinese Path to Modernization ...,https://china-cee.eu/2023/05/12/an-interpretation-of-the-chinese-path-to-modernization-under-international-law/
China's Modernization of Mao,https://www.jstor.org/stable/45319517
Key features of China's modernization in 2023,https://news.cgtn.com/news/2022-12-30/Key-features-of-China-s-modernization-in-2023-1gbaoni0gqQ/index.html
Ten perspectives to understand Chinese modernization,https://english.news.cn/20230304/649b101c913f4370a97a6c066717923e/c.html
"Modernization | Nature, Features, Examples, & Facts",https://www.britannica.com/topic/modernization
Xi calls on Jiangxi to write its chapter in Chinese ...,http://english.scio.gov.cn/topnews/2023-10/14/content_116746262.htm
"Leadership, strategic capability and prospect of Chinese ...",https://news.cgtn.com/news/2023-03-10/Leadership-strategic-capability-and-prospect-of-Chinese-modernization-1i3smvAkGFG/index.html
"BRI promotes modernization, mutual benefit",https://epaper.chinadaily.com.cn/a/202310/19/WS65306b68a310d4219e3a9625.html
Modernization with Chinese Characteristics and Great Power,https://books.google.com.sg/books?id=IbnHEAAAQBAJ&pg=PA17&lpg=PA17&dq=Chinese+style+modernization&source=bl&ots=dC46vZnlZ9&sig=ACfU3U3E0dRwlcpqY0z7BRVFiQ782NgzCA&hl=en&sa=X&ved=2ahUKEwjIwObtkIWDAxVwIEQIHbO8DhM48AEQ6AF6BAgEEAM
"""Chinese-style Modernisation Has Created a New Form of ...",https://www.chinabankingnews.com/2023/02/12/chinese-style-modernisation-has-created-a-new-form-of-civilisation-peoples-daily/
Modernization Chinese style,https://www.cairn-int.info/journal-futuribles-2023-4-page-75.htm
Zheng Yanxiong: HK serving as springboard for world to ride ...,https://english.dotdotnews.com/a/202311/27/AP656465fce4b05139963abf87.html
Chinese path to modernization: The Way forward,https://en.ndrc.gov.cn/news/mediarusources/202304/t20230428_1355489.html
Top US and Chinese diplomats agree to build on recent ...,https://wtop.com/world/2023/12/top-us-and-chinese-diplomats-agree-to-build-on-recent-progress-in-ties/
The Inspiration of Chinese Modernization for African ...,http://lagos.china-consulate.gov.cn/eng/zlszc/202303/t20230331_11052772.htm
China's modernization guides Hong Kong to common ...,https://news.cgtn.com/news/2022-11-18/China-s-modernization-guides-Hong-Kong-to-common-prosperity-1f3Ak28FnDW/index.html
"South Korea | History, Map, Flag, Capital, Population ...",https://www.britannica.com/place/South-Korea
Work report is Chinese-style modernization on full display,https://bau.com.hk/article/2023-03/09/content_1083326154849910784.html
Video: Chinese Use Water Cannons and LRAD to Stop ...,https://maritime-executive.com/article/video-chinese-use-water-cannons-and-lrad-to-stop-philippine-supply-mission
Needs true statesmen to build a super-sized Singapore but ...,https://www.linkedin.com/pulse/chinese-style-modernization-modernized-socialism-build-john-lee